{
  "schema": "capability-provider/v1",
  "capability_id": "outline.projection.render/v1",
  "provider": {
    "plugin_id": "com.plotpilot.novelagent.outline-projection",
    "release_id": "31d75c8c77d3c6ff9cc7571cc05e00bd376093272f813f794f8447dc9274215f"
  },
  "input_schema": "outline.projection.render-request/v1",
  "output_schema": "outline.projection.render-result/v1",
  "result_contract": "artifact-bundle/v1",
  "supports": [
    "run",
    "cancel"
  ],
  "deterministic": true,
  "accepted_data_formats": []
}
