{
  "schema": "capability-provider/v1",
  "capability_id": "source.evidence.search/v1",
  "provider": {
    "plugin_id": "com.plotpilot.novelagent.source-structure",
    "release_id": "c050fd331a5d1dddb0451333fd478d764e81e7156f56e52a522c27a7009fb807"
  },
  "input_schema": "source.evidence.search-request/v1",
  "output_schema": "source.evidence.search-result/v1",
  "result_contract": "artifact-bundle/v1",
  "supports": [
    "run"
  ],
  "deterministic": true,
  "accepted_data_formats": []
}
