{
  "schema": "capability-provider/v1",
  "capability_id": "analysis.book.atom.manual/v1",
  "provider": {
    "plugin_id": "com.plotpilot.novelagent.donor-analysis",
    "release_id": "80dc50b850b3e16a7609a39cffbb91c9624d709e5da547ecf00f73afe19e4b53"
  },
  "input_schema": "analysis.book.atom.manual-request/v1",
  "output_schema": "analysis.book.atom.manual-result/v1",
  "result_contract": "candidate-batch/v1",
  "supports": [
    "run",
    "validate"
  ],
  "deterministic": true,
  "accepted_data_formats": [
    "book-analysis-taxonomy/v1"
  ]
}
