{
  "schema": "capability-provider/v1",
  "capability_id": "style.manufacture/v1",
  "provider": {
    "plugin_id": "com.plotpilot.novelagent.style-manufacturing",
    "release_id": "e217d3b901ee66ebcc922d078fa9bcb3deae040816076dbb568f44afd7f1802f"
  },
  "input_schema": "style.manufacture-request/v1",
  "output_schema": "style.manufacture-result/v1",
  "result_contract": "candidate-batch/v1",
  "supports": [
    "run",
    "resume",
    "cancel"
  ],
  "deterministic": false,
  "accepted_data_formats": [
    "book-analysis-taxonomy/v1",
    "lexicon/v1"
  ]
}
