{
  "schema": "capability-provider/v1",
  "capability_id": "model.provider.anthropic.invoke/v1",
  "provider": {
    "plugin_id": "com.plotpilot.novelagent.provider-anthropic",
    "release_id": "3425ec5086efc7667735cd66828e49bf4dd15282dd549035f46270da25ecf6b8"
  },
  "input_schema": "model.provider.anthropic.invoke-request/v1",
  "output_schema": "model.provider.anthropic.invoke-result/v1",
  "result_contract": "artifact-bundle/v1",
  "supports": [
    "run",
    "cancel"
  ],
  "deterministic": false,
  "accepted_data_formats": []
}
