{
  "schema": "capability-provider/v1",
  "capability_id": "source.structure.revise/v1",
  "provider": {
    "plugin_id": "com.plotpilot.novelagent.source-structure",
    "release_id": "c050fd331a5d1dddb0451333fd478d764e81e7156f56e52a522c27a7009fb807"
  },
  "input_schema": "source.structure.revise-request/v1",
  "output_schema": "source.structure.revise-result/v1",
  "result_contract": "candidate-batch/v1",
  "supports": [
    "run",
    "validate"
  ],
  "deterministic": true,
  "accepted_data_formats": []
}
